{
  "schemaVersion": "1",
  "spaceId": "space-incident-response",
  "sourceId": "source-runbooks",
  "sourceRecordId": "runbook-84",
  "sourceVersion": "84",
  "operation": "upsert",
  "sourceUrl": "https://sources.invalid/runbooks/84",
  "sourceObservedAt": "2026-09-18T10:00:00Z",
  "audience": ["source-group:research"],
  "sourceAclVersion": "31",
  "idempotencyKey": "source-runbooks:runbook-84:84"
}
